"title","con_url","hit","rec","contents"
"씨발놈의 직접 해먹은 집밥스","https://gall.dcinside.com/board/view/?id=superidea&no=208547&page=6",6178,52,"오늘아침은 카레에 내가 만든 수제 우동 ㅇㅅㅇ면이 쫄깃하다못해 질겨버린 데스어제 퇴근후 냉장고보니 야채들은 시들고두부도 유통기한 다되고 ㄷㄷㄷ느타리는 들깨볶음 두부는 꼭짜서 계란야채넣고 전부침이번에 밥통도 lh인가로 바꾸고쌀도 밀키퀸 주문해봤는데 먹었던 쌀중 원탑임찰지고 알살아있고 존맛ㅋ블랙사파이어포도 샀다내손아님 ㅋㅋ;평일중에 시간은없고 재료도 마땅찮아서 찜닭배달제일매운맛 굿굿회사점심으로 먹음 함스짬밥처리와 보쌈깻잎 마늘잎장아찌 레몬미소 다 씨발놈메이드임지난주말 샤브샤브해먹음<U+00A0>땅콩소스 안해주면 서운해한다 이기요 ㅋㅋ참외 고추장장아찌 만드는중인데더 충격적인 사실은 고추장도 일년 숙성된 씨발놈메이드임ㅋ이러다 유리병도 씨발놈이 만들어버릴 기세간단히 매생이국 후루룩 끓이고제육 양배추 누카즈케 진미채무침 소시지구이ㅇㅅㅇ- dc official App출처: 기타음식 갤러리 [원본보기]"
"리스트랩 써본것들 (SBD Pioneer Elitefts)","https://gall.dcinside.com/board/view/?id=superidea&no=208546&page=6",2005,25,"운동가기전에 할거 없어서 써봄  단단함&lt;&lt;&lt;&lt;&lt;&lt;&gt;&gt;&gt;&gt;&gt;&gt;부드러움  SBD- 윈터 스티프60 플렉스100  Pioneer- 스트랑귤레이터 팬텀 릴리브리지 가디언(니랩)  Elitefts- 슈퍼헤비 크레잇 헤비 주피터 노말(니랩) 레드 오렌지  SBD  Stiff 60- 가장 구매하기 쉬운 스티프 리스트랩  브레이크인 되기 전 까지는 흘러내리지만 어느정도 사용 후에는 단단하게 잡아주는 느낌 좋음  벤치 시에 손목을 뒤로 눕혀서 무게 받는 사람들에게 추천  분명 처음에는 호불호가 갈릴 수 있겠으나  손목은 누적 데미지에 굉장히 취약하므로 본인은 스티프를 추천한다  Flex 100- 굉장히 잘 늘어나는 편. 두께감도 있어서 다 감으면 잡아주는 느낌 좋음  그대신 너무 늘어나서 1미터 감았다 풀었다 3세트만 해도 되게 귀찮음  개인적으론 추천하기 어려운 느낌  sbd는 구매대행을 하던지 직배를 시키던지 파는곳 많으니 알아서 사자  Pioneer  Strangulator 60- 이거 사기 전 까지는 팬텀이 제일 스티프 한 줄 알았음  이게 확실히 느껴질 만큼 덜 늘어남. 팬텀의 70프로? 정도밖에 늘어나지 않는 느낌  리스트랩 두께 자체도 얇진 않음  깁스같은 느낌을 원한다면 이걸 사도록 하자  댄 그린이나 빅마이크가 추천하는 apt사의 그 회색 리스트랩과 쌍둥이다  Phantom 60- 써본 랩 종류 중 가장 두꺼움. 재질도 사포마냥 거침  어지간한 브랜드 랩 갖다 줘도 그것보다 두께가 1.5배나 됨  처음엔 굉장히 뻣뻣하나 브레이크인 되면 신축성이 생각보다 있는 편  SBD 스티프가 너무 들뜬다, 혹은 탄력이 부담스럽다 하는 사람에게 추천  개인적으론 손목 쓸리는 것 제외하고는 가성비부터 보호력 모두 만족스러움  Lilliebridge 60- SBD 스티프와 Elitefts Krait 중간 격인 느낌  고급스러운 재질과 굉장히 훌륭한 탄력을 가지고 있음  아주 스티프 랩은 아니지만 특유의 도라이같은 탄력이 있어서 잡아주는 느낌이 아주 훌륭함  대문짝만한 로고 패치가 부담스러우면 파이오니어에서 주문 후 큰 로고를 떼고 일반 로고를 달아달라고 부탁해보자  Black Mamba- 얘는 니랩으로만 써 봤지만 재질은 리스트랩과 같을 것이기에 후기를 남김  재질 자체는 얇고 탄성이 아주 좋다  18인치 주문 시에는 손목이 접히는 역도에 쓸 수 있을 정도의 느낌  단단한 cast 느낌의 리스트랩을 원한다면 추천하지 않지만  BB하는 분들처럼 리스트랩을 항상 차고 있거나 손목이 딱딱하게 눌리는게 싫은 사람에게 추천한다  개인적으로 팬텀의 벨크로 구조가 훌륭하다고 생각한다  사장님께 팬텀처럼 벨크로 박고 엄지고리도 만들어주세요!  요청사항에 넣는것도 추천한다  https://generalleathercraft.com/ 공홈이다  Untamed10 혹은 Phdeadlift 같은 10% 할인 코드도 있다  리프팅 라지에서는 팬텀과 strangulator를,  elitefts에서는 릴리브리지를 취급하는 경우도 있으니 필요한 경우 거기서 시키면 된다  https://youtu.be/BBN-Dx42EAw  공식 유튜브에서 모든 종류의 자사 랩들 비교도 해 준다  훌륭한 회사  Elitefts  Super Heavy 80- 말 그대로 슈퍼 헤비다  댄 그린이 Strangulator과 슈퍼 헤비 이 리스트랩을 사용하는걸로 알고 있다  SBD 스티프에 필적 할 정도로 두터운 재질과 아주 강력한 탄성이 있음  브랜드 자체가 30% 50% 할인을 수시로 때리니 가성비로는 탁월함을 보여준다  200 넘게 치는 리프터 혹은 장비 리프팅을 하신다면 1순위로 고려할만한 제품  Krait 80- elitefts에서 랩종류 단 하나만 추천하라면 요게 아닐까?  벤 폴락도 애용하는 그 제품  파이오니어 릴리브리지와 꽤나 비슷한 느낌이지만 좀 더 부드러운 재질과 약간 포근한? 두터운? 느낌이 있다  미친듯한 탄성과 얇지 않은 재질에서 오는 안정감이 탁월하다  손목이 약간 쓸리는것만 감안하면 리프팅용 졸업템 가능  Heavy 80- 손목이 아주 약한 사람에게도 추천할만한 마지노선 제품  헤비라는 이름 답게 3바퀴 이상 감기면 아프지 않고 아름답게 잡아준다  탄성도 좋아서 가볍게 감으면 가볍게 쓰기 좋고  crank 시켜서 감으면 꽤나 단단하게 잡아 준다  운동을 도라이같이 으아으아 하지 않고 여유롭지만 느슨하지 않게 즐기는 스타일에 알맞다고 할 수 있겠다  Jupiter80 Red80 Orange60- 얘네는 플렉스 한 편이라 한번에 쓰겠다  개인적으로 플렉스 리스트랩을 쓰면서 드는 생각이 있다  늘어나서 조이면 어느정도 잡아주는 느낌이 있긴 하지만  피가 안 통하는 것에 비해 생각보다 지지력이 좋지 않다  그래서 다 처분했음  비비식으로 항상 차면서 운동하거나 부담없는 무게를 다루시는 분들  지지력 보다는 안정감 정도를 찾는 분들이 사는게 좋을 것 같다  아래는 엘리트핏 리스트랩 모두에게 해당되는 사소한 단점  벨크로가 너무 강력해서 리스트랩 몸통이 금방 너덜너덜 해 진다  벨크로를 떼서 정확히 맞는 위치에 다시 꿰메거나 폭5cm 길이6cm정도 암놈 벨크로로 연장하는걸 추천한다  https://elitefts.com/ 공홈이다  30% 50% 할인도 잦거니와 가끔은 60불이상 99불이상 무배 이런것도 한다  일반 가격으로 사는건 아까우니 할인을 노리도록 하자  마크벨사 제품은 아직 사용해보지 않음  갱스타/ 스트롱/ POWER 요 세 리스트랩은 사용자도 많고 매니아층도 두터운 걸로 알고 있다  프로 리프터들에게 검증 된 제품이므로 구매해도 문제는 없을 것 같다  타이탄 제품은 생각이 없음  스티프를 사려면 시그니쳐 골드를 사야 하는데  세미 영장류처럼 생긴 놈이 빨강노랑 보호대 차면 가관일 것 같아 고려조차 하지 않았다  본인이 댄그린처럼 절세 미남이라면 구매하도록 하자  두번째로 단단한 thp는 말만 스티프에 가깝지 브레이크인 되면 전혀 스티프 하지 않다고 들었다  리프팅라지 https://liftinglarge.com/  여기서는 타이탄 마크벨 파이오니어 제품을 부분부분 취급한다  60달러 이상 무배라는 좋은 제도가 있으므로 애용하도록 하자  cs도 흘륭한 편으로 알고 있다  엘리트핏 슈퍼헤비, 크레잇 / 파이오니어 스트랑귤레이터, 팬텀 지금 남은건 얘네 안 쓰는 것들은 다 팔거나 나눔했음  - dc official App출처: 파워리프팅 갤러리 [원본보기]"
"3-내가 추구하던 시음회의 최종적인 목적과 맥주 시장의 현실에 대하여","https://gall.dcinside.com/board/view/?id=superidea&no=208545&page=6",2209,19,".  .  휴가 복귀 간 아는 분께 맥주 선물 드리려고 퓰러스 ESB를 찾아다녔었다. 미리 구해놔도 됐겠지만, 몇달 전까지만 해도 바틀샵-펍의 기본 라인업 중 하나였기에 구하는 게 어려울 것 같지는 않았어서. 그런데 웬걸, 못 구했다. 차선책으로 영국맥주 비슷한 거라도 찾아봤는데 그림자도 못 봄. 하여 결은 다르지만 비슷한 의미부여를 할 수 있는 필키로 골랐다.  몇몇 사장님들께 여쭤보니 영국맥주 찾기가 어려워졌다고 한다. 요새 입문하시는 분들은 뉴잉글랜드식 맥주나 도수 높은 스타우트보다 영국맥주가 낯설다고. 퓰러스는 곧 수입이 중단될 것 '같다'는 말도 들린단다. 어이가 없어 반문했었다.  '아니, 그러면 한국맥주 시장에서 영국식 에일의 다양성은 어떻게 보장받으라고?!'  그 전부터 어느 정도 느끼는 바는 있었다. 크래프트 맥주 시음회에 갔더니 '벨지안 쿼드러플'의 존재 자체를 모르는 분들도 계셨었고... 토플링 골리앗 '도로시'가 캘리포니아 커먼이라 했을 때 뭔지 반문한다든가.  유행의 구석탱이에 있는 맥주는 소외받는다는 생각이 들었다. 아니, 그러한 경향은 늘 있었으나 19년도 들어 심해진다는 인상을 받았었다.  나는 이전부터 내가 여는 시음회나 참여하는 쉐어링, 하다못해 관심 있는 친구들에게 맥주설명 해줄 때도 맥주재료의 개성을 이해하고, 이어 스타일을 섭렵하며, 양조자의 의도를 파악하는 과정이 중요하다 말한 사람이다.  재료는 맥주가 어떤 저변을 가진 술인지 알게 해준다. 양조의 영역을 벗어나 단순 재료특성의 조합만 나열해도 맥주는 수천여가지 이상의 개성을 지닐 수 있다. 스타일을 이해할 때 우린 이러한 재료적 특성이 현재 어떻게 쓰이고, 어떤 느낌으로 의도되는지 알수 있게된다. 스타일은 불변이 아니다. 지금이야 올드한 취급을 받는 서부해안식 IPA는 불과 5년 전만해도 세계적으로 사랑받던 최신예였다. 그 당시 'IPA가 어떻게 탁할 수 있지?'라는 관념을 모든 양조사가 도그마적으로 받아들였다면 현대의 탁한 IPA는 존재하지 않았겠지. 스타일을 넘어서, 혹은 같은 스타일 내에서도 다른 모습으로 존재하는 양조자의 의도.  이런 맥락을 강조함으로서 나는 사람들이 맥주에서 날 수 있는 특징들을 경험하며 제 입에 맞는 스타일을 찾아가길 바랬고, 다른 주류에 비해 놀랍도록 다양한 맥주의 특징들을 이해하길 바랐다. 그러면 상황에 따라, 기분에 따라, 그날 겪었던 일에 따라, 혹은 경험의 누적으로 인한 인식의 변화에 따라 그때그때 맞는 맥주를 골라 마실 수 있기 때문에. 그리고 이게 결과적으론 다양한 맥주를 골라마실 수 있는 시장을 연다고 봤다.  곁가지 다 쳐내고 말하면 '편식하지 말자'쯤 될건데, 직관적으로 맛난 일부 스타일, 개인이 선호하는 스타일의 맥주만 마신다면 자연히 맥주가 지니는 다양한 매력을 느끼지 못하게 될 것이기 때문이다.  그래, 알고서 안 먹는 것이라면 또 모르되, 존재 자체를 모르게 되고 수입조차 끊길 위기라니...  이 바닥의 기본 가치 중 하나는 다양성이다. 이제 영국효모가 뉴 잉글랜드식 맥주의 런던효모 캐릭터로만 의의를 갖는 시대가 다가올지도 모르겠다..   - dc official App출처: 주류 갤러리 [원본보기]"
"듴공트인별 ~ 심케&뮤뱅 컴백, 시연&수아 셀카, 굿나잇 메시지","https://gall.dcinside.com/board/view/?id=superidea&no=208544&page=6",704,21,"한국음악방송 뮤직뱅크 현장 사진이 도착했습니다 컴백스테이지는 체크하셨나요? 새로운 드림캐쳐의 세계를 들여다봐주세요 https://www.youtube.com/watch?v=n8Jv1Zunbb0마무리는 멤버들의 굿나잇 인사 그리고 보너스 짤 출처: 여자 아이돌 갤러리 [원본보기]"
"고라니 인스타 업데이트","https://gall.dcinside.com/board/view/?id=superidea&no=208542&page=6",15035,41,"대충 좋은 하루 보내라는 내용 출처: 여자 아이돌 갤러리 [원본보기]"
