"title","con_url","hit","rec","contents"
"일러스트)염버니 그리는법","https://gall.dcinside.com/board/view/?id=superidea&no=208682&page=3",3754,49,"요즘 간단하게 포켓몬 그리는 방법이 있길래 그것보다 훨씬 간단하고 쉬운 일러스트로포켓몬을 그리는 방법을 가져왔어일러스트는 어도비의 프로그램인데 간단하게 하면 재밌어 깊게 하면 존나빡치니 대충해또 할진 모르겠지만 일단은 염버니포켓몬 애니메이션을 아십니까? 염버니가 진.짜 귀엽습니다.보면서 색이랑 생김새를 확인할 염버니 하나 가져오자 그냥 구글에 염버니 검색하고 알트+프린트스크롤누르면 캡쳐됨일러스트에서 컨트롤브이하면 저렇게 나옴대충 원을 그리면서 시프트를 누르면 정원이 나옴 그거 그리고 i를 누른 상태로 염버니를 누르면원의 색이 누른곳의 색으로 채워짐 그 다음은 A 직접 선택자로 원의 양쪽 꼭지점을 누르고 밑으로 대충 내려주자얼추 저정도 내리면 됨그 다음은 대충 저정도 되는 원을 그려줘 시프트 누르면 정원 나오니까 누르지말고그리고 위아래 꼭지점을 누른 상태로 오른쪽으로 좀 땡겨주면대충 이런 모양이 되는데 E를 누르면 크기랑 기울기 조절을 해줄수 있어사실 과정 몇장 더 찍은게 있긴 한데 사진 제한이 있어갖고 다 올리면서 해줄수가 없네 어차피 해볼놈 없을텐데 대충해하나만 먼저 모양을 잡은 다음에 위치를 잡고 E를 누른 다음에 알트를 누르고 기울이면 기울인 도형이 복사가 됨ㅇㅇ그 다음은 두개를 같이 선택하고 컨트롤+G를 눌러주면 그룹상태가 되서 같이 움직이게됨그럼 이제 그룹상태인 도형에 마우스 우클릭을 하면 이런 창이 나오는데 반사를 해주면 됨반사된 도형 두개의 위치를 적당히 잡아준 다음에 그룹잡고 얼굴 메인이랑 얘를 같이 가운데 정렬 해주면얼굴형이 완성 정말 간단하지만 벌써부터 염버니가 보이지않니? 아님? 아님말고난 개인적으로 이렇게 선 여러개인거 존나 극혐해서 걍 패스파인더로 도형합체시킴 이건 취향따라 다른데 할렴하고 말렴말아도됨오히려 안하는게 나중에 수정하긴 훨씬 편해 근데 이거 수정할 일 없을거같으니 난 합체시킬게그 다음은 입을 만들자 아까 머리 만들듯이 정원을 그려준 다음 양옆 꼭지점만 위로 올려주면 이런 모양이 나옴그 다음은 원 두개 적당히 그려서 이빨이랑 혀를 표현해주고 색을 고르던가스포이드로 색을 뽑아오면 되는데 애니꺼에서 뽑은 색이 좀 맘에 안드네이번엔 소드 일러스트로 가져옴 색은 가져온 그림에서 I누르고 대충 쪽쪽 뽑아주면돼내가 색감이 존나 좋아서 완벽하게 할수있다 하면 직접해도 되는데 내 경험상 그런새낀 30명중에 한명 있을까말까해처음 그린 입 전체부분을 클릭한 다음 컨트롤+C 후 컨트롤+시프트+V이러면 자기 위치에 그대로 복사붙여넣기됨 그 다음 시프트 누른 상태로 이빨원이랑 혀원 한번더클릭해주고마우스 오른쪽을 눌러서 클리핑마스크를 해주면 이런 모양이 나옴 그러면 입까지 완성 얘넨 무조건 같이 움직일거니까또 셋 다 같이 잡은 다음에 컨트롤 + G를 눌러서 그룹화를 해주고 미리 만들어놓은 얼굴에 배치를 해줘많이 왔다 진짜 이제 입 위쪽에 선하나 찍 그어 난 한 0.3픽셀정도 했던거로 기억함다음엔 아까 머리랑 입 만든것처럼선 위에 원하나 그려서 양옆 꼭지점 살짝 올려주면 코까지 완성돼 진짜 별거없다 썼던거 계속쓰고 그치?정말 간단한건 간단하게 그릴수있으니까 너희도 일러스트를 시작해보는건 어떨까?이제 눈이야 아까 얼굴,입,코 만들듯이 원하나 그려서 대충 양옆꼭지점 내려준다음입이랑 똑같이 해주면 돼 진짜 계속 반복이야 정말 간단해원 위아래 하나씩 추가하고 가운데 도형 복붙한다음 클리핑마스크까지 해주고 그룹화 시킨 다음에 완성시켜놓은 얼굴에 배치해주면흠... 괜찮나 맘에 안들면 대충 눈크기 조절해 난 좀 맘에듬근데 많이 맘에 안들어서 결국 크기조절함 이번에도 아까 털만들었을때랑 똑같이 반사해주고 그룹해서 가운데정렬거의 다왔어 이제 반창고랑 귀만 만들면 돼 반창고부터 하도록 하자원래 라운딩박스로 할랬는데 라운딩박스하니 존나 어색해서 결국 원을 조정해서 만들기로 결정타원을 하나 그려준 다음 옆 꼭지점을 살짝 내리고 머시기 툴로 조절하면 되는데 머시기툴 이름이 기억안나네펜툴 꾹누르고있으면 나오는놈들의 맨밑에있는 놈인데 이거 이름 아는놈 제보받음하고있는놈들은 댓글에서 그 제보된거 찾아서 써라 ㅇㅇ 그거 키고 꼭지점누른상태로 위아래로 드래그 적당히 하면 저렇게 나옴 그리고 배치해주면 와! 거의끝! 난 개인적으로 홍조있는거 좋아해서 선 세개 찍찍 긋기로 결정대충 사선 하나 그어준다음 굵기 조절하고 기울여주고 알트 누른상태로 드래그를 한번만 하면 복사가 되고그 다음에 컨트롤 + D를 눌러주면 방금 한 행동이 그대로 한번 더 실행되면서 홍조가될 선 세개가 나온다 이거야이 세개를 잡아서 그룹화 하고 반사해서 대충 위치 잡아주면 양 볼의 홍조까지 완성이제 귀만 하면 끝이다 또 적당히 타원 그린 다음에 아까 반창고 만들때 쓴 그 머시기 툴로원의 위아래를 드래그가 아니라 클릭하면 이렇게 뾰족하게 만들어짐 이게 꼭짓점펜이었나 기억이 안나네 ㄹㅇ;;암튼 이렇게 만들어준 다음에 색을 염버니의 귀 맨위쪽 색으로 뽑아낸 다음밑의 두가지 색을 원으로 만들고 또 입만들때 했던것처럼 귀모양 클릭 후 컨트롤+C 컨트롤+시프트+V그 후 클리핑마스크 해주고 다시 컨트롤 + V하고 나온거 E눌러서 크기 줄여주고 귓속 색 뽑아내준다음그룹까지 해주고 약간 기울인다음 반사시키고 그룹잡고 가운데정렬해주면염버니 완성이다 이거야 포켓몬 애니메이션을 아십니까? 정말 갓애니입니다.와 정말 간단하다 우리 모두 일러스트를 시작해보는건 어떨까?출처: 포켓몬스터 갤러리 [원본보기]"
"갑옷 수집! Ghost of a Tale 8화!","https://gall.dcinside.com/board/view/?id=superidea&no=208681&page=4",11260,17,"이전 이야기[1]  [2] [3] [4] [5] [6] [7]가기 전에 케이지 옆에 있었던 도르래에 대해서 물어보자.그런 거 본 적 없다고? 플레이어는 못 봤지만 틸로는 봤으니까 상관 없다.사일러스 :텃밭에서 여기까지 보급품을 끌어올리는 용도로 쓰는 거야.너라면 안뜰이랑 통하는 지름길로 쓸 수 있을지도 모르겠네.아마 너 정도 몸무게면 괜찮을 걸?&gt; ""아마도""?사일러스 : 글쎄, 니가 술병보다 무겁지 않기를 빌어야지 뭐.맘에 안 들면 그냥 계단으로 다녀도 돼.숏컷! 숏컷을 마다할 이유가 없지그런데 도시락 담는 바구니에 생쥐가 들어가도 괜찮은 걸까?아무튼 텃밭을 통해 윗층까지 올라갈 수 있게 된 것이다.이제 사일러스가 맡긴 임무를 수행하기 위해 두 가지 준비물이 필요하다.그 중에서도 당장 구해두면 쓸모가 많은 갑옷 세트를 우선순위에 두도록 하자.첫빠따는 대장간에 있는 허리 보호구인데, 가져가도 뭐라고 하는 사람도 없으니까 확 집어가자.그 다음으로 유치장에 가보면 구스토는 세상 모르게 쳐자고 있고,페이탈리 혼자만이 뜬 눈으로 밤을 지새우고 있는데그 옆을 보면 훔친 건지 뭔지 웬 뚝배기가 놓여 있다는 걸 알 수 있다.이것도 냉큼 가져가고 싶지만 구스토에게 허락을 받아야하니 잠시 미뤄두고페이탈리에게 깨어있는 이유나 한 번 물어보도록 하자.페이탈리 : 야!페이탈리 : 뭘 하러 쏘다니는 거야?&gt; 아직도 깨어있네, 잠을 못 자나봐?페이탈리 : 뭔데 너, 우리 우마?&gt; 그- 그냥 도와줄 수 있을까 싶어서?오지랖이 넓은 틸로는 만나는 아무나 막 도와주고 다닌다페이탈리 : 왜 날 도와주고 싶은 건데?&gt; (침묵한다)페이탈리 : 그래... 그럼 뭘 어떻게 해주겠단 거야?&gt; 잠 못 자는 이유 나한테 얘기해줘도 좋아.페이탈리 : 내가 왜? 그런다고 뭐가 달라지는데?&gt; 그러면... 세 밤 동안 잘 수 있게 도와줄 테니까, 그 다음엔 꼭 얘기해줘.페이탈리 : 좋아... 정 그러고 싶으시다면.주인공은 음유시인이라서 남이 잠 못 자고 있는 걸 지켜볼 수가 없는 모양.아무튼 계약을 따냈으니 세 밤 동안 숙면을 선사해주면 뭔지 모를 비밀을 들을 수 있을 것이다.그나저나 페이탈리는 주인공의 이름을 알고 있었다. 어떻게?페이탈리 : ... 항구 쪽에서 아내랑 같이 공연하는 걸 봤었어. 몇 년 전에.사람들이 아주 너한테서 눈을 떼질 못하더라구?덕분에 주머니 싹쓸이하기 편했지 뭐야!도둑년&gt; 메라... 아직도 아내에 대한 소식이 없어.페이탈리 : 아직도 포기 안했단 말이구나?&gt; 내가 그럴 사람 같아?페이탈리 : 사실 그래, 딱 그런 부류로 보여. 근데 나라고 뭘 알겠니?그 여자도 참 운도 좋다니까, 너 같은 사람이 찾으러 다녀주고.&gt; 너도 구스토가 지켜주지 않아?페이탈리 : 구스토가? 뭐 그렇긴 해... 근데 우린 남매잖아, 그냥 붙어다니는 거뿐이야.&gt; 구스토는 그렇게 생각 안 할 텐데.페이탈리 : 걔도 말은 그렇게 하고 다니지... 맨날 그래.페이탈리 : 그 있잖아... 점 치는 카드가 보이면 열 두장만 가져와줘, 내가 점 쳐줄게.어쩌면 메라의 운명도 예견할 수 있을지 몰라.&gt; 할 줄은 알고?페이탈리 :당연히 알지, 우리 우마가 가르쳐줬단 말야.감옥 밖의 일이라고 해봐야 카드 한 세트만 있으면 충분히 알 수 있다 이거지...어쩌면 메라에 대한 것도 알아낼지 몰라.&gt; 아무 카드나 열 두장 구해오면 되는 거지?페이탈리 : 그래, 카드 이름은 '운명의 손길'이라고 부르면 돼.Hand of Fate? 이거 패러디냐이제 수다는 다 떨었으니 도둑 아가씨에게 꿀잠을 선물해주자현직 음유시인 틸로가 부르는 자장가 한 곡이면 첫날밤은 거뜬할 것이다.페이탈리 : 자장가?!페이탈리 : ... 그래, 조용한 걸로 해줘.조용한 거라면 갓 뽑아낸 신곡이 하나 있지페이탈리 : 이 노랜... 니 이야기구나? 그렇지?&gt; 왜 그렇게 생각해?페이탈리 : 부르는 모습을 보니까 알겠더라구.다음 이야기는 어떻게 되는 거야?&gt; 나도 몰라. 아직은.페이탈리 : 좋은 노래긴 해, 근데 도움이 될 것 같진...코 자요잠이 엄습함에 따라 페이탈리의 눈은 천천히 감기기 시작했다.잠자는 생쥐들과 음유시인 생쥐 한 마리이제 아침까지 남은 시간은 잠으로 때우도록 하자.지난번에 접수했던 간수장 사무실이 위치도 좋고 적절하다그렇게 아침이 밝았다.경치좋고다시 생쥐들에게 돌아가서 뚝배기를 넘기라고 딜을 넣어보자.페이탈리 : 이거 양품이야. 딱 니 사이즈네.구스토 : 거저 얻는 물건은 아니지.뭐랑 바꿀래?&gt; 플로린이면 될까?구스토 : 플로린? 이런데서 플로린을 어디다 쓰는데?그나저나 우린 원리원칙에 충실한 생쥐거던.페이탈리 : 맞아... 우린 돈 같은 거 안 쓰기로 했어.화폐불신자 (도둑)구스토 : 넌 노래를 직접 쓰는 스타일이야?페이탈리 : 아니면 더 잘하는 음유시인이 만든 걸 가져다 쓰는 쪽이야?&gt; 음유시인은 전부 자기 노랜 자기가 만들어.페이탈리 : 그럼 우리에 대한 발라드를 한 곡 써주기로 할래?구스토 : 그래! ""구스토와 페이탈리의 발라드"", 우리 이름을 알려야 할 거 아녀!페이탈리 : 나도 도와줄게.&gt; 니가?구스토 : 그래, 쟤가 사실 노래 좀 부르는 애거든.&gt; 그러면 압운 규칙은 어떤 걸로 할까?구스토 : ""압운 규칙""- 야! 여기 전문가 납셨다!페이탈리 : 2행 연구로 하자.구스토 : ㅁ- 뭐?? 2행 연구가 뭔지 니가 어떻게 알아?페이탈리 : 아는 건 범죄가 아냐 구스토, 범죄라면 더 많이 알아야겠지만 뭐.페이탈리 : 자, 내 뒤에 붙여봐. 끊기지 말구.이제 가사를 골라줘야 하는데,1. 각운이 맞는가2. 가사의 내용이 올바른가이 두 개의 요소만 따지기 때문에 적당히 봐서 괜찮은 걸 골라주기만 하면 된다.혹시라도 실패하면 처음으로 되돌아오는 동시에 받는 경험치가 줄어들기 때문에 뒷목을 잡지 않도록 조심해야 함.하지만 가사 번역은 어려우니까 패-쓰!페이탈리 : 하하! 너 잘한다!제 점수는요~구스토 : 알았어, 알았어- 굳이 뭐 노래나 춤까지 다 만들 필욘 없으니까-페이탈리 : 진짜 노래로 만들어줄거지?&gt; 그래, 근데 시간이 좀 걸릴 거야.페이탈리 : 그럼 나중에 알려줘.페이탈리는 샐릿에서 먼지를 털어낸 다음 당신에게 들어보였다.도둑 노래와 함께, 뚝배기는 이걸로 획득!출처: 중세게임 갤러리 [원본보기]"
"TV조선 .... 방심의 대가 ㄹㅇ; ....jpg","https://gall.dcinside.com/board/view/?id=superidea&no=208680&page=4",54543,3643,"TV조선 박정훈 앵커가 고른 한마디 '방심의 대가' 문빠구리  세균맨  홍남기  이인영  애미추 해골찬까지 화면에 딱 비춘 다음 갑자기 5년전으로 넘어가서 과거의 문재인을 보여줌. 문적문 마지막 딱 짜파구리 클라이막스 까지 완벽 ㅋ 출처: 국내야구 갤러리 [원본보기]"
"여원장님,김사부,수쌤, 은탁쌤","https://gall.dcinside.com/board/view/?id=superidea&no=208679&page=4",1526,20,"여원장님에게 경련이 와서 cpr을 해야하는 상황에 김사부는 고민하다가 dnr을 어기고, 결국 cpr을 하기로 결정했음. 결정하고나서는 망설임없이 무조건 살려야한다는 생각으로 cpr을 했고, 결국 살렸고, 여원장님을 살리자마자 바라본건, 여원장님의 뜻을 알고 돌담에 같이 오래있었던 은탁쌤이였음ㅠㅠ김사부는 고개를 숙였고, 은탁쌤은 울었고ㅠㅠ아름쌤과 은탁쌤 대화에서 은탁쌤이 김사부를 이해는 하지만,처음으로 김사부의 이번 결정이 옳은지 모르겠다고 말했고, 아름쌤은 김사부도 아마 그렇게 생각하실거라고 말했음. 그 바로 다음씬이 여원장님 곁에 엎드려 앉아있는 김사부를 보여줌. 이때 수쌤이 들어와서 여원장님의 뜻을 어겼다는 김사부를 여원장님이 깨어나시면 이해해주실거라고..말해줌ㅠㅠㅠ김사부,은탁쌤,수쌤 다 너무 맴찢이였는데..ㅠㅠㅠㅠ오래 돌담에 같이 있어서 나오는 서사때문에 관계가 잘 보여서 좋았었어ㅠㅠㅠ그래서 남은2회차에 에필로그라도 김사부와 은탁쌤의 첫만남이라던지 김사부가 수쌤한테는 돌담즈와 수쌤,은탁쌤,도일쌤이 짐이 아니라 힘이라고 말했었는데 은탁쌤한테는 이야기 안했어서 둘이 이야기하는게 나왔으면 함ㅠㅠㅠㅠ짤ㅊㅊ짹출처: 낭만닥터 김사부2 갤러리 [원본보기]"
"이찬원 보정짤 떴는데 완전 이쁘다","https://gall.dcinside.com/board/view/?id=superidea&no=208678&page=4",5055,83,"@fullheart96_힐링찬또출처: 미스터 트롯 갤러리 [원본보기]"
"리바이브 마크2 티탄즈 보고가","https://gall.dcinside.com/board/view/?id=superidea&no=208677&page=4",875,14,"티탄즈컬러 특) 먹선 많이 안넣어도 되서 좋음무기 색분할 없어서 에나멜 건메탈색으로 대충 칠해줌프로포션이 아주 좋음RG에서 게이가 되어버렸던 종아리를 육덕지게 살려놔서 각도기 자세로만 세워둬도 느낌있음잘생긴 얼굴 넘버링은 에마의 1호기로 해줬음 그 이유는..이걸 해보고 싶었음 ㅋㅋ 메뉴얼 공식포즈 한번 해주고전설의 MG 박스아트도 따라해봄이걸로 막투가 4대가 되었다프라탑에 RG 티탄즈도 있던데 언젠가는 만들겠지 헣헣출처: 건담  갤러리 [원본보기]"
"190801 MGMA 무대 채령 4p by ATTRACRYEONG","https://gall.dcinside.com/board/view/?id=superidea&no=208676&page=4",1373,24,"https://twitter.com/0605ATTRACTIVE/status/1231516997231362048?s=19 <U+2744>ITZY! MIDZY! 날자!<U+2744><U+2728>항상 보은하는 있갤 되겠습니다<U+2728>출처: ITZY 갤러리 [원본보기]"
"뉴비의 치아바타","https://gall.dcinside.com/board/view/?id=superidea&no=208675&page=4",1501,16,"오븐이 너무 놀고있어서치아바타 만들어 봤어쓰레빠 4켤레 나왔당틀니 낄 때가 되서 그런지사먹는것도 그렇고 해먹는것도달달한건 보다 담백한 빵이 땡기더라완벽하게 못 만들어도 금방 구운거 한김 식히고 바로 먹으면누룽지 맛 나면서 개꿀맛이다밥 먹었는데도 들어가더라 돼지 ㅇㅈ?ㅋㅋ 한개는 치아바타인척 하는 공갈빵 나옴출처: 과자, 빵 갤러리 [원본보기]"
"오늘의 트포 구매","https://gall.dcinside.com/board/view/?id=superidea&no=208674&page=4",1734,13,"아키하바라 정글샵에서 산 트포들 새제품 시즈 임펙터와 스프링어, 무비 브레이크어웨이 중고지만 상태 좋은 디럭스? 브롤, 클래식 핫로드, 무비 레비지 그리고 공벌레 덤으로 가족들 잔뜩- 꽤 쏠쏠하게 잘 건진것 같다 특히 ss사웨에 레비지를 안넣어줘서 슬펐는데 덩치가 좀 크긴해도 커여운 레비지 생겼으니 좋은듯 스튜디오 브롤은 다좋은데 포탑 안돌아가는게 아쉬워서 포탑 돌아가는 옛날거 비클로 두려고 삼 핫로드는 그냥 관심 없지만 동생꺼 브레이크어웨이도 F-35 좋아해서 위시리스트였는데 엄청 싸게 구해서 좋다. 2,200엔인데 무려 새거인듯. 임펙터 스프링어랑 같이 한국가서 뜯어봐야징 아래는 정글샵 사진 대충 올려봄 지하 하나가 통째로 트포들이고 한쪽 구석에만 3사나 다른 로봇 조금 있는듯 주의할건 박스에 들어있는데도 중고인것들이 있어서 은근 햇갈리는 정도 종류도 나름 다양하고 옛날 제품들도 많다 만다라케도 가봤지만 여긴 정리는 커녕 대충 뭔지 보이지도 않게 박스 위만 보이겠금 눕혀서 대충 던져놓은데다가 겁나 좁은 통로형식에 다른것들이랑 섞여있어서 보기도 엄청 불편하고 가격도 그닥이고 별로인듯. 라디오회관인가에 ss 리더쇼키 실물 전시되있던데 제품은 없드라..ㅜ 당연한것인지 어라옵도 아직 일본은 정발 안된듯 은근 기대했지만 코빼기도 안보여따 출처: 트랜스포머 갤러리 [원본보기]"
"코로그 900 다 모았다","https://gall.dcinside.com/board/view/?id=superidea&no=208673&page=4",4292,79,"하 시발 진짜 정신병오는 줄 알았다 개추박으셈보상도 저거 하나랑 인벤 늘려줄때 추는 춤 다시 보여주기 이게 끝임 이 애미뒤진년 누가봐도 저거 똥아니노?코로그 열매 은행나무 열매같은건가 생각했는데 저거 보니까 지들 똥인듯 ㄷ하이랄 성에는 대체 왜 숨어있는 건지 모르겠고 몇 개는<U+00A0>공략없이 어케 찾으란건지 모르겠음만약에 코로그 찾을 꺼면<U+00A0>https://www.youtube.com/user/Terminator8464<U+00A0>에 들가면 지도 표시한거 있으니까 참고하면 좋음코로그 번호도 달려있고 찾는 법도 영상있으니까 따라하거나 하면 댐이제 킬튼인가 몬스터 메달 따러 감출처: 닌텐도 스위치 갤러리 [원본보기]"
"[리뷰] 튜더 블랙베이 크로노 스틸 vs 다크 (재업)","https://gall.dcinside.com/board/view/?id=superidea&no=208672&page=4",1319,14,"솔직히 튜더 크로노 다크를 비교적 좋은(?) 가격에 바로 구할지는 생각도 못했다..  어쨌든 다크를 사보니 툴워치로 쓸 수 있는 스틸도 끌려 연이틀 기추에 성공!  블베 크로노가 개취인 이유는 바로 데이트+200m방수  * 아마 쓰리카운터 크로노에 데이트를 넣으면 밸런스가 망가지지만(ex, 엘프리메로, ROC) 투카운터엔 가운데 자리가 비어서 밸런스가 나름 잘 잡힘  공식 홍보용 사진은 역시 두 모델 다 엄청 이쁘다. 튜더 블랙베이 크로노그래프 다크(ref.79350DK) 튜더 블랙베이 크로노그래프 스틸(ref. 79350) 먼저 튜더 크로노 다크와 스틸의 공통된 기본사양은 다음과 같다.  무브먼트 : MT5813  (브라이틀링의 무브를 수정했다고 욕 많이 먹지만 그래도 COSC 인증은 받은 준수한 무브)  파워리저브 : 70hr  기능 : 데이트, 크로노그래프, 200m 방수, 2중 잠금 버클  사이즈:  케이스 (40.5mm, 용두제외)  두께 13.5mm  러그 22mm  여기까지가 공통된 부분이고 본격적인 리뷰인 다크vs스틸 차이점을 알아보자.  1. 크로노 초침 끝의 레드포인트  스틸은 크로노핸즈가 스틸인 반면  다크는 같은 스틸이지만 끝부분 화살표에 레드 포인트를 줬다.  다이얼 위로 보이는 차이점은 이게 다인듯  다른 차이점은 없다.  2. 고정코&브레이슬릿 먼저 버클과 결합되는 고정코 비교사진을 보면  다크는 길이가 짧고, 스틀은 1코 보다도 길다.  그리고 다음 사진에서 반대쪽 버클 고정코 비교사진을 보면 다크는 고정코에 분해할 수 있는 핀이 없는 고정형이라 6시방향에는 더이상 링크를 추가할 수도 뺄 수도 없다.  반면 스틸은 핀을 제거 후 링크를 추가하거나 뺄 수 있다.  아마 이 부분에서 동양인과 서양인 모두에게 착용감의 측면에서 불편함or편안함을 줄 수 있을지도..?  이 부분에선 다크가 더 낮은 점수를 받을 듯 싶다.  (왜 굳이 차이를 뒀는지 의아하긴 함)  + 추가적으로 스틸은 BB58과 같이 링크 양옆에 리벳이 달린 리벳 브레이슬릿인 반면, 다크는 구형 BB와 같은 일반 레이슬릿임. 개인적으로 리벳이 없는 다크의 브레이슬릿이 더 깔끔해서 이쁜듯 3. 케이스백  아마 내가 알고있는 튜더와 롤렉스는 한정판을 생산한 적이 없다.  이번 다크 크로노가 최초일듯 싶은데 그래서 그 특별함을 케이스백에 적어놨나봄.  다크는 한정판 넘버링과 'SPECIAL EDITION'이 추가로 각인되어 있다.  스틸은 그냥 가본적인 내용만 각인됨  그리고 서브마리너와는 다르게 케이스백이 뒤툭튀가 아니라 착용감이 (서브마리너 대비)매우 좋다!  5. 스페셜에디션 만의 특별함  해당 넘버링의 선수에 관한 정보를 구입 시 매장에서 설명을 해줌.(이름, 포지션, 출생일, 주요기록 등) 일단 왜? 선수가 갑자기 튀어나오냐고 생각할텐데  이번 블랙베이 크로노 다크 한정판은 뉴질랜드의 럭비팀인 'All Blacks'의 업적을 기리기 위해 만들어졌다. (ALL BLACKS 팀의 로고) 그래서 이 팀이 창설된 이후부터 팀을 거쳐간 선수들의 수 만큼 한정판 갯수도 정해짐(총 1181개니까 1181명이 거쳐간듯)  특이한 점은 앞으로 새롭게 팀원이 보충되면 그 수만큼 추가적으로 생산을 한다고함.  (근데 솔직히 추가생산분이 국내백화점에 들어올 확률은 제로라고 봄.. 그래서 국내스탬핑 소유자들은 컬렉션용으로 구입했을 듯)  이걸로 튜더 블랙베이 크로노그래프 스틸&다크의  공통점과 차이점에 대한 리뷰를 마침  막짤은 스틸+다크 크로스샷!  출처: 시계 갤러리 [원본보기]"
