"title","con_url","hit","rec","contents"
"빌린이 사진 올려봐여 몇롤 찍었음","https://gall.dcinside.com/board/view/?id=superidea&no=208831&page=1",232,8,"어때여출처: 필름카메라 갤러리 [원본보기]"
"갈라진 얼음판 베이스 만들기","https://gall.dcinside.com/board/view/?id=superidea&no=208830&page=1",485,19,"크랙클도료 아무거나 발라줌 두껍고 짙게, 사진은 마르고 갈라진모습 흰색 붓 프라이머용 프라이머를 그냥 위에 짜버림 좀 두껍고 그래도 상관없음 마르고나면 크랙클도료 사이사이에 프라이머가 스며들고 흰색으로 착 달라붙게 마름 하늘색도료에 물타서 바름, 콘트라스트건 레이어건 뭐건 상관없음 중요한건 갈라진틈새까지 하늘색이 스며들어야함 흰색으로 드라이브러싱 끗  - dc official App출처: 미니어처게임 갤러리 [원본보기]"
"글랜 피딕 21년 시음기","https://gall.dcinside.com/board/view/?id=superidea&no=208829&page=1",499,19,"포장 박스 :  개 촌시러운 오렌지 색 너무 촌스러워서 짭 산줄 알았음. 그런데 보다보니 또 익숙해짐..  앞 뒤 다 열려서 자랑 겸 진열 가능 색 :  굳이 진하지도 연하지도 않고 딱 위스키 색 향 :  첫 뚜따하고 한잔 따르고 맡으니.. 음... 캐런 잔에 코박해도 알콜 내음이 안올라오는게 신기했음. 그런데 향 자체가 뿜뿜 올라오진 않았음 맛 :  흠... 따르즈 말자 한잔했는데, 굳이 21년을? 사야하는 의문이 들었음 18년도 충분히 가치가 높고 향과 맛이 더 좋았는거 같음. 돈 좀 아까웠음 음!? 캐런잔에 처음 따라서 맛보고 실망한 뒤 폰보면서 10분 정도 빙빙 돌리고 입에 대는 순간 신세계가 펼쳐졌음 라이 위스키 보다 더 달큰향 향과 맛이 올라오는데  라이나 테네시처럼 뭔가 설탕같은 인위적인 단맛이 아닌 배추나 양파에서 나는 부드러운 단맛이 입을 감쌌음 입이 머금었을 때의 향은..  향알못이라서 재대로 설명은 못하겠지만  상당히 안정을 주는 향이었음.  그렇다고 벗뇌조처럼 향이 부족하다는게 아니라  뭔가 아로마처럼 마음이 풀리는 향??? 처음에 말했듯 알콜 부즈는 끝까지 느껴지지않았음. 비싼건 비싼 값을 하는구나를 다시 느낌. 결론 뚜따 뒤 바로 마시지 말것. 누가 사주면 꼭 한번 마셔보길 권장. 진짜 꽁돈 혹은 보너스 탔을때 한병 재워두고 아껴아껴 먹기엔 괜찮 그런데 편하게 마시기엔 가격차이 때문에 피딕 18년이 더 나을듯 (편하게 기준은 하루 2온즈 정도) 한줄 요약 : 피딕 18년 승!   - dc official App출처: 주류 갤러리 [원본보기]"
"기추는 고추요","https://gall.dcinside.com/board/view/?id=superidea&no=208828&page=1",354,14,"60’s Nobellux2카운터크로노 벨쥬7733운좋게 재치브슬 박스포함 매물구했습니다회판 선레이에 역팬더 디자인재치브슬 뱀비늘마냥 싱기방기하게 생겼는데줄 한번 줄이면 되돌릴수없을거처럼 쳐맹글어놨네요다행히 일오차 5초 리저브는 45시간 정도역시 60년지난 시계들도관리만 잘해주면 현행싸다구갈길수있습니다은장으로 바꾼 레스톤과 비교좌 벨쥬7734 데이트 수동무브우 벨쥬7733 논데이트 수동무브당연히 벨쥬7750보다 가볍고 얇아 선호합니다이번껀 운모글라스포함 13후반 정도 두께15.5손목에 사이즈 36mm저같은 난민새끼들은 빈티지로 피신하십시오빈티지붐은 옵니다...- dc official App출처: 시계 갤러리 [원본보기]"
"늅뉴비 살면서 처음으로 사만 모델 샀습니다!","https://gall.dcinside.com/board/view/?id=superidea&no=208827&page=1",372,15,"외국 사는데 때마침 한국 들어가서 냉큼 오크타운 가서 사왔네요. 컬렉터라 모델만 샀고 딴건 안 삼ㅎㅎ 원래 스마만 사려했는데 데스가드가 넘 이뻐보여서 결국 3상자 10만원 쓰고왔어요.. 나중에 조립하는거랑 도색하는것도 올릴께요! 희희출처: 미니어처게임 갤러리 [원본보기]"
"내가 먹을라고 만든 딸기케이크","https://gall.dcinside.com/board/view/?id=superidea&no=208826&page=1",493,15,"오븐없어서 어제 에어프라이어로 시트 구웠는데 진짜 맘에 안들어ㅠㅠ 근데 재료 떨어져서 그냥 했어.. 다행히 맛은 있음 딸기 많이 넣는데 충실한 디자인 ㅎㅎㅎ  냉장고 넣어놨다<U+00A0> 점심 때 먹어야지  출처: 과자, 빵 갤러리 [원본보기]"
"어스라이즈 스타스크림 간단 포토리뷰","https://gall.dcinside.com/board/view/?id=superidea&no=208825&page=1",549,24,"어스라이즈 스타스크림 별꺅입니다.여러분의 구매 결정에 조금이라도 도움이 되면 좋겠습니다.출처: 트랜스포머 갤러리 [원본보기]"
"진돗개 2마리(남매) 시바견 1마리를 어제 분양 받은 견주입니다","https://gall.dcinside.com/board/view/?id=superidea&no=208824&page=1",432,20,"어제까지만 해도 비가 오지 않아서 애들을 하루 종일 밖에서 뛰어놀게 해줬지만 오늘은 비가 와서 그럴 수가 없었습니다. 그래서 낑낑거리는 걸까요?아까 밥을 줬을때는 조금 잦아들다가 제가 방금 또 사진찍으러 가니까 낑낑되고.....개들이 개집 문 앞에 바닥을 발톱으로 많이 긁어놨더라고요. 지금은 청소를 했지만 제가 밥 주러 갔을 때는 스티로폼 잔치가 되어있어서 그것도 치우고마음이 너무 아픕니다ㅜㅜ임마들을 어떻게 키워야하는게 좋을까요? 아버지가 분양을 받아왔지만, 아버지는 하시는게 없습니다 ㅜㅜㅜ지금은 또 잦아들었네요.개집은 성능이 좋아요. 밑에 단열재도 깔고 비닐도 깔고 개집이 따뜻합니다.출처: 멍멍이 갤러리 [원본보기]"
"이리와 셀프캠 루다.여름.gif","https://gall.dcinside.com/board/view/?id=superidea&no=208823&page=1",905,34,"오늘건 여름누나가 더 커엽네 출처: 여자 아이돌 갤러리 [원본보기]"
"생일 아침","https://gall.dcinside.com/board/view/?id=superidea&no=208822&page=1",960,16,"양지 덩어리 전복 넣고 볶다가 미역넣구 1-2시간 끓임 자연산 미역이라 오래 끓여야함 소고긴 중간에 찢었음 나물 세가지랑 시루떡 이건 아빠 사무실 간식 대량 제조해서 보냄 랠리쉬랑 딸기잼 바른 빵에 계란샐러드 맛있넴 누구나 아는 맛  - dc official App출처: 기타음식 갤러리 [원본보기]"
"색다른 신발 리뷰: 사보 데드리프트 ""PRO""","https://gall.dcinside.com/board/view/?id=superidea&no=208821&page=1",886,31,"이번에 노토를 구하고 데드리프트화는 충족됐으니 로우바 할 때 쓸 신발을 찾다가 구하게 된 신발입니다.  캔디토 인스타를 염탐하던 중 캔디토가 이 신발을 신고 스벤데 다 하는 걸 보고 관심이 생겼습니다.  우선 이 신발의 이름은 SABO deadlift pro이고 주 목적은 데드리프트 용도라고 설명 되어있더군요. 기존 사보 데드리프트와는 다른 제품입니당.  한 가지 신기한점은 아주아주 약~간의 오프셋이 있습니다. 공홈에 들어가서 보면 뒷굽을 높혀 놓은 것이 리프팅시에 도움을 줄 것이다. 어쩌고 저쩌고 있는데 실제로 좋을지는 사용해봐야 알 것 같네요. 그리고 특징이 뒷굽이 사다리꼴 모양으로 넓게 퍼져있는데 신어보니 접지력과 안정감이 정말 뛰어납니다.  사진으로 보시죵.  먼저 박스는 아주 단촐하게 오네용.. 그치만 이렇게 맘 따듯한 손편지를 동봉해줍니다. 코로나쉑만 아니었다면 당장 헬장으로 달려가고 싶네요. 흰 봉투에 뭐가 쌓여있나 봤더니 영국발 하리보 ㄷㄷ;; 잘 먹겠슴다. 전체적인 외형은 이렇습니다. 기존 버전과 동일하게 두 개의 벨크로로 되어있고 매쉬, 스웨이드 소재로 어퍼가 구성되어 있습니다. 사보가 퀄이 안좋다는 평이 많던데 케이스 바이 케이스인지 제 기준으로는 무척 좋아보이네요. 박음질, 마감, 전체적인 완성도 모두 기준 이상입니다. 접지되는 부분이 넓어 딱 보기에도 안정감이 느껴지는 바닥입니다. 옆모습.. 벨크로 퀄리티나 저 돌돌 돌아가는 부분이나 모두 만족스럽습니다. 마감 보시라고 찍은 사진입니다. 이정도면 퀄 좋은 편 아닌가요?  말씀드렸던 사다리꼴 모양의 밑창. 사보에서 설명하길 더 안정적인 무게 분배를 도와준다고 하더군요. 함 더..  이 신발은 딱 하나의 신발만을 구매하고 싶은 분께 강추입니다. 캔디토도 그렇게 사용하고 있고 아직 사용해보진 못했으나 신었을때 느낌은 쫀득쫀득하니 스벤데 무리 없겠네요.  착화감은 매우 좋고 매쉬소재라 나름 통풍도 되는 것 같습니다. 무게도 가볍구요. 솔직히 단점 꼽아보라면 전 못 찾겠는 신발입니다. 애초에 공홈 보면 자랑 일색입니다. 신 기술의 총집합이니 말 그대로 PRO라는 이름에 걸맞는 신제품이니 그러다보니 마감에 더 신경을 썻을지도요.  노토의 매력과는 정말 다른 또다른 매력이 있는 브랜드임이 확실하네요. (그래도 노토가 젤 편리하긴 한듯..)  가격은 한국 돈으로 약 17만원대 나름 고급라인으로 나온터라 가격대가 좀 있었습니다.구매처는 9for9에서 구매했고 배대지 이용해서 약 7일 걸렸네요.  재고가 얼마 남지 않았으니 관심있으신 분들 한 번쯤 들어가보시길.  아참, 사이즈는 발 실측 251에 40사이즈 갔습니다. 적당히 잘 맞네요. 노토는 39신고 컨버스는 255~260정도 신습니다. 정사이즈로 가시면 될 거 같아요. 늘 파립갤에서 좋은 정보, 재밌는 글 그리고 운동에 대한 열정 잘 얻어가고 있습니다. 모두 코로나 조심하시고 득근하세요. 감사합니다.   - dc official App출처: 파워리프팅 갤러리 [원본보기]"
"예지, 리아: It'z me 개인티저 배경화면","https://gall.dcinside.com/board/view/?id=superidea&no=208820&page=1",404,23,"예지(YEJI) & 리아(LIA): ""It'z me"" 개인 티저 고화질 배경화면입니다.배경화면 원본 사진은 과즙매니아 블로그에서 직접 다운 받으실 수 있습니다 :D블로그:<U+00A0>https://hqphotos.tistory.com/110출처: ITZY 갤러리 [원본보기]"
"야구팬으로써, 포켓몬 소실 트레이너들의 투구폼에 대한 고찰","https://gall.dcinside.com/board/view/?id=superidea&no=208819&page=1",2521,97,"나는 푸키먼 골드 이후로 한번도 안해보다가이번에 소실로 다시 푸키먼 하게된 사람임나한테는 이번 푸키먼 그냥저냥 할만한 게임이었고, 엔딩도 보고 자시안도 잡았음대신, 나는 다른사람들과는 달리 친근감을 얻은 포인트가 좀 다르다스샷으로 설명하겠음(급하게 이미지 필요해서 윾튜브 에디션으로 대체함 ㅈㅅ)단델&호브 형제딱봐도 어디서 본 것 같지 않음?팩사장님 LA있던 시절에... (이하중략)아무튼 그때 동양인 투탑 노모 히데오 투구폼에서 따온 것 같음투구폼이 특이하니까 못알아볼수가 없다..근데 이것뿐이 아님야청은 몬스터볼을 던질때 저렇게 높이 키킹하는데프로야구에서 저렇게 높이 키킹하는 투수는 찾아보기 드뭄나도 누구지? 누구지? 하다가 떠오른 인물이 있는데실제 인물은 아니고, 다이아몬드 에이스라는 야구만화에 나오는 주인공사와무라 에이준의 투구폼임뭐? 근데 이렇게 키킹하는 투수가 현실에도 있긴 있다고?있음. 팩사장 전성기 시절...근데 아무래도 이시국 국가에서 만든 게임이다보니 모티브는 자국 만화 캐릭터에서 나오지 않았을까 싶다다음.우리 귀여운 마리다마리 투구폼은 성격 닮아서 상당히 평범함게다가 널리고널린 우완투수라서, 찾기 힘들었다.확실한건 아닌데...다나카 마사히로랑 비슷하긴함다만 차이점이 있다면, 마리는 던지기 전에 양팔을 위로하는데다나카 마사히로는 와인드업 전에 그런 준비자세가 없다는점?아무튼 마리 투구폼은 일본 야구에서 널리고 널린 폼이라 한명의 투구폼이라고 특정하기 힘듬비트놈은 이게임 유일 좌투수다마찬가지로 일본 좌투수 투구폼도 거기서 거기다.다리 올리고, 1초 내외로 잠시 멈췄다가 던지는거(거의 교과서적인 자세로 가르친다고 하더라. 우리나라처럼 개개인의 특성이 살아있는 투구폼을 찾기가 힘들다)그나마 네임밸류있고 비슷한 투구폼을 찾아본다면....와다 츠요시 정도 될 것 같네볼티모어 오리올스까지는 갔던 투수임조금 특이 케이스는 요 순무 형님인데오버스로치곤 팔이 낮게 내려와있고, 힘차게 던지는 투구폼임내 뇌리에서 한명이 딱 스쳐지나갔다.선동열 되시겠다.이시국겜인데 왜 우리나라 선수를 모티브로함? 아까 박찬호는 아니라매ㅇㅇ 그렇긴한데선동열은 예전에 주니치에서 마무리로 뛴 적이 있다.워낙 임팩트가 강하고 특이한 투구폼이라서 이걸 모티브로 했을수도 있을 것 같다.근데 이렇게 적어놓고보니가라르 지방 사실 영국을 모티브로 한거라며?영국은 야구 조또 인기 없는 국가인데 ㅋㅋㅋㅋㅋㅋㅋㅋㅋㅋㅋㅋㅋㅋㅋㅋㅋㅋㅋㅋㅋ인기없는 이유 중 하나가, '도루는 남을 속이는 행위이므로 비신사적이라서'라고함....이젠 나도 뭐가뭔지 모르겠다 쉬벌.....출처: 닌텐도 스위치 갤러리 [원본보기]"
"래블 떳다","https://gall.dcinside.com/board/view/?id=superidea&no=208818&page=1",703,12,"혼코에 떳네 ㅋㅋㅋ사전예약인거 봐선3월말쯤부터 나올꺼같음가격은 865만원https://zen.ly/ccxx223출처: 바이크 갤러리 [원본보기]"
"UFC 250 헨리 세후도 vs 조제 알도","https://gall.dcinside.com/board/view/?id=superidea&no=208817&page=1",613,21,"흠. 예상은 했지만 순서가 많이 바뀐 느낌. 암만 봐도 얀이랑 스털링중 한 명이 먼저 받았어야 한다고 생각하는데, 어찌 되었건 경기는 재밌겠다. 알도가 테익다운 디펜스는 여전히 좋지만, 항상 발목을 잡는 여러 요소(?)들이 있어서. 물론 세후도가 그 알도의 허점들을 파고들만한 능력도 충분히 갖추고 있고 최근까지 보아온 알도의 모습이라면, 쉽지 않은 경기가 될 수도.  아무튼. 그렇단다 ㅂㅂ 출처: UFC 갤러리 [원본보기]"
"노량진 과잠바 만화(풍자)","https://gall.dcinside.com/board/view/?id=superidea&no=208816&page=1",2973,50,"과잠바 부러웡...ㅠㅠ출처: 카툰-연재 갤러리 [원본보기]"
"스탭 인별 종방연 사진 (뼈쌤이다ㅠㅠ)","https://gall.dcinside.com/board/view/?id=superidea&no=208815&page=1",1226,21,"뼈쌤 종방연 사진 처음 보는 거 같음양호주니는 웃으니 얼마나 좋니...근데 어디 영상 찍으신 스탭분 안 계신가요...?https://www.instagram.com/p/B8-kL_zJgwq/?igshid=alsx2k4unkit출처: 낭만닥터 김사부2 갤러리 [원본보기]"
"양으로 승부하는 박원장 막촬단체사진 업뎃ㅋㅋㅋ","https://gall.dcinside.com/board/view/?id=superidea&no=208814&page=1",1357,27,"그동안 올라온 사진들도 있고 처음 보는 사진들도 있는데밍구기가 올린 사진 그냥 다 올려봄ㅋㅋㅋㅋ잘 나온 사진 선별따윈 없음ㅋㅋㅋ 받은 거 그냥 다 올린 느낌ㅋㅋㅋㅋㅋ출처: 낭만닥터 김사부2 갤러리 [원본보기]"
"그가 돌아왔어","https://gall.dcinside.com/board/view/?id=superidea&no=208813&page=1",262,13,"https://youtu.be/rsk8lbwbC7A꼬마친구랑 조금 큰 친구로 만들었어코로나 때문에 마스크도 씌워줬오전선 잘라서 붙이고 미라클픽스(퍼티)로 조금 매꿔주고 아크릴로 도색했어(도색은 아직 초보라 조금 조잡해..ㅎ)과정샷은 많이 못찍어줬어 미안해 형들출처: 모형 갤러리 [원본보기]"
"우리집 꾸꾸 보구갈사람","https://gall.dcinside.com/board/view/?id=superidea&no=208812&page=1",477,31,"이제울집온지 2주정도 되어가는 햄찌다아직 날 무서워해서 서운하다그래도 주는 먹이 족족 다받아먹어서 점점 확대돼간다..후후출처: 동물,기타 갤러리 [원본보기]"
"레벨쟝 25000키로 후기","https://gall.dcinside.com/board/view/?id=superidea&no=208811&page=1",409,8,"3천키로대에 입문용으로 업어와서 29000키로 다되가는데여태까지 타면서<U+00A0>엔진계열에서 말썽한번 안일으킴 진리의 혼다다 이거시야주행도중에 체인한번 빠졌지만 점검안해서 생긴일이니 패스하고소모품관리만 잘해주면 문제없이 나가더라시트고가 690이라 어디 유턴하다가 어어어어ㅓ 하면서 제꿍할일은 거의없음의외로 코너링에 강하고 험지돌파도 해보면 가능한거심단점이라면 막 하루에 400~600키로씩 내달릴때 기준으로 오래타면 다리저림 당연한거니 넘어가고출력이라면 내가 탄게 300ㅊㅊ짜리라 부족한감은 있지만 500cc면 충분하겠지?쿼터따린데도 강원도오르막길 70~95km 언저리 찍더라국도에선 110키로 크루징 가능하고 120~140까지 나오는데 엔진 뒤질라함출력 모자라서 스카우트로 넘어왔는데 영상보니 또 꼴리네젠장요약: 괜찮은 바이크다출처: 바이크 갤러리 [원본보기]"
"이래서 기름 삼각편대 삼각편대 하는거야(씹팩트주의)","https://gall.dcinside.com/board/view/?id=superidea&no=208810&page=1",1618,85,"이소영 복귀하고난 후 4,5라운드 기록이다이렇게 기록을 보면 왜 삼갓편대 인지 다나와기름 킹갓편대 위고 아래고 용병밖에 없어국내선수 중엔 양뽕,박정아 말곤 보이질 않네<U+00A0>그리고 소영이 괜히 까였어존나 잘했누하여튼 여배갤 그세력 프레임 짜서 선동 좀 그만해라팩트로 쳐맞기 전에 ㅋㅋㅋㅋ출처: 여자배구 갤러리 [원본보기]"
"오홍홍 z바디 s렌즈 좋와요~~~~","https://gall.dcinside.com/board/view/?id=superidea&no=208809&page=1",222,7,"장단을 모두 드러내는 사진들을 올려드렸읍니다.대부분 최대개방이고장점을 보고싶다면 해상력이나 역광제어 수차제어단점을 보고싶다면 보케보세염z50.8과 2470f4가 섞여있음출처: 디지털 사진 갤러리 [원본보기]"
"나의고양이 테레비뿌시고 반성하던 시절","https://gall.dcinside.com/board/view/?id=superidea&no=208808&page=1",1066,136,"요즘 무료한게 먼가 뿌시고 싶어테리비같은거딱히 볼것도 업꼬나 잘해떠??돈쓰는귀신...- dc official App출처: 야옹이 갤러리 [원본보기]"
"퍼리 대축제 갔다온 만화.manhwa","https://gall.dcinside.com/board/view/?id=superidea&no=208807&page=1",4156,135,"이벤트는 2월 8일에 열렸는데 늦장부리다가 이제서야 후기만화 올리게 되었읍니다.. 아무튼 재밌었다리 좋았다리..블로그는 여기로출처: 카툰-연재 갤러리 [원본보기]"
"낚시꾼 틀딱이 만들어 먹은거","https://gall.dcinside.com/board/view/?id=superidea&no=208806&page=1",1065,25,"육수용으로 겨우내 두달간 말린 고등어  고기먹다 눈에보여 굽 무늬 잡아서 대충 썰고 대충 튀기고 대충 삶고 아지도 대충 썰고 튀기고  - dc official App출처: 기타음식 갤러리 [원본보기]"
"(스압)대구의 크래프트 펍들-2 엠버스펍","https://gall.dcinside.com/board/view/?id=superidea&no=208805&page=1",363,15,"제 직장이 철원에 있는지라 방문이 늦었습니다. 덕분에 1년 가까이 인스타로만 이야기했었네요. 무슨 디씨갤러도 아니고ㅋㄱㅋㄱㄱㅋ  ...대구의 크래프트 펍을 굳이 대중 지향-매니아 지향으로 나눠 나열한다면 버내너펍과 함께 매니아 지향 선상의 가장 극단에 위치한 곳일 겁니다.  그만큼 최신 유행을 발 빠르게 받아들이고, 매니아들의 의중 또한 가벼히 여기지 않고 반영하는 편입죠.(대구에서 킹수와 개러지를 들인 몇 안되는 업장이기도 합니다.) 하다못해 대중들을 노렸다 싶은 가격 좋고 화사하고 부담 적은 맥주들도 일정 이상의 퀄리티를 담보합니다. 라인업이 조금 적다지만 가게 규모를 보면 이해가 가는 정도입니다.  음..... 써놓고 보니 치트키네용.  첫 잔은 포르치니 버섯이 들어간 뽀할라의 포터였습니다. 버섯의 특징이 뒷맛에 상당히 올라오며 유럽계 홉에서 날 수 있는 젖은 흙, 비온 뒤 숲과 어느 정도 유사해 재미있습니다. 로덴바흐 알렉산더가 실물 체리를 넣음으로서 플랜더스 레드의 붉은 과일 캐릭터를 더욱 강조했다면, 얼씨한 홉을 쓰는 정석포터의 홉 특징을 포르치니 버섯으로 극대ㅎ.... 는 무슨. 무난하게 재미있으면서 과하게 이질적이지 않았습니다. 이태리 요리 하시는 분께 선물로 드리려고 한병 챙겼음. 건너편은 Lovingwithoutw....<U+00A0> 음. 대학 동기입니다. 아. 뭐. 캔-오-블리스 시트러스  싸고 맛나네용.  요리도 제법입니다. 적어도 냉동피자와 감튀를 메인으로 삼는 인싸펍보다는 훨씬 훌륭합니다. 맛나네용. 유린기와 소고기전병튀김(이름 기억 안남)입니다. 배럴 텐피디. 얘도 좀 사기 같은 친굽니다. 종량세로 인한 가격변화를 극적으로 체감하게 해주니까요. 배럴에이징 버전이 노멀 버전보다 더 싸게 들어오다니...  전에 큰 캔으로 마셔봤을 때도 그랬습니다만, 캐릭터가 조금 인공적이어서 저는 원본을 더 좋아합니다. 적고나니 역스놉 같네용ㅎㅎ  무난-맛남 라인업들.  ....기억하시는 분이 계실진 모르겠으나 17년도 경 대구의 업장들을 리뷰하고 다녔던 일이 있습니다. 당시 대구바틀샵, 비사이드, 릴렉스053 등 많은 크래프트 업장들이 생겨났었죠. 나름 행복했었던 가운데 한편으로는 걱정도 많았습니다. 파이는 고만고만한데 경쟁자는 많은, 어찌보면 가시밭길이었으니까요. 실제로 지난 몇년 간 야심차게 등장했던, 그리고 서로 연대하며 살길을 찾던 많은 업장들이 뒤편으로 사라져가고.. 혹은 현실의 벽 앞에 타협해가는 과정을 지켜봐야했습니다. 매니아로서 아쉬운 맘이 없지는 않았지만 그래도 이해합니다. 어찌 됐든 다들 먹고살자고 하는 일이니까요. 다만 맥주에 쏟은 열정,<U+00A0>제대로 보상도 못 받고 허리띠를 졸라매야했던 대구의 많은 업주분들이 안쓰러울 뿐입니다.  엠버스펍의 강점, 뚜렷합니다. 매니아틱한 맥주를 들이면서도 대중성을 신경쓰고 퀄리티도 담보하죠. 대구 주거 밀집지 중 하나인 상인동에 위치하고 있어 고정적이고 소비력 있는 계층들을 유입시킬 수 있다는 것도, 비록 가능성의 영역이긴 하지만 강점일겁니다. 요리도 특색있게 하고 실력도 준수합니다. 동행이 있었던지라 비록 얼마 이야기 나누지 않았지만 사장님의 열정 역시 대단했구요. 이래저래 만족스런 방문이었습니다.  하지만 한편으론, 지난 시절 지나간 많은 크래프트 펍-바틀샵 들을 떠올리게 되어 불안하기도 합니다. 솔직히 전성기 시절 퍼센트도 모자람은 없었거든요. 열정만으로 헤쳐모ㅇ... 아니, 헤쳐나가기엔 대구바닥은 아직 문이 좁습니다.  건투를 빕니다. 철원지역에 입사하며 이래저래 대구바닥과 거리를 두게 되었습니다만, 제 정체성은 여전히 대구에 있습니다. 이만한 펍을 대구에서 다시 찾을 수 있을런지요.  퇴사하게 되면, 보다 자주 뵙겠습니당.   - dc official App출처: 주류 갤러리 [원본보기]"
"겜캐릭 그렸던것들 올려봄 10","https://gall.dcinside.com/board/view/?id=superidea&no=208804&page=1",14179,60,"라잔이랑 부라퀴에용쌔무스는 첨그려보내요난투에서 너무 만나기 싫어요출처: 중세게임 갤러리 [원본보기]"
"인스타) 채연이 헤어스타일 따라해본 오토하쟝","https://gall.dcinside.com/board/view/?id=superidea&no=208803&page=1",3465,111,"출처: 엠넷 갤러리 [원본보기]"
"디지안나맥 샘플공유로 돌아옴","https://gall.dcinside.com/board/view/?id=superidea&no=208802&page=1",1104,105,"저번에 싸운건 지금생각해도 내잘못 없으니까 시비걸면 병먹금 시전함  일단 a4샘플이고 제작자랑 논의중인건 아직 고화질이 없어서 a3는 불가능할거같음.  샘플상으론 3번째정도 홀로그램이 젤 잘 나온거같고  양각은 택배로 받아봐야 다시 파악가능할듯함.  이거 탑승총대로 돌아오도록 하겠음.  p.s. 메탈지(은빛) 샘플도 의뢰예정. 나중에 정리해서 한번에 올리도록하겠음. 아쉬운점이나 수정해야할게 보이면 의견제시해주세요.  고퀄을 위해 모두의 의견과 제작자의 밤샘(?)이 필요합니다. 출처: 겨울왕국 갤러리 [원본보기]"
