"title","con_url","hit","rec","contents"
"뉴비 자취하고 볶음밥 맹금","https://gall.dcinside.com/board/view/?id=superidea&no=208408&page=8",2913,30,"안녕 저번에 감자탕 50인분한 뉴비야이번에 어떻게 아다리가 맞아서 자취를 시작하게 되었어이제 한 5일 된거같은데, 지금까지는 대충대충 때우다가, 오늘 나름 구색 갖춰진 거 같아서간단하지만 맛잇는 볶음밥한 거 올리려고 해저번에 요 자 쓰면서 한거 좀 오그라들어서 그냥 반말이랑 음슴체 섞어쓰려해우리 기붕이들은 그런거 개의치않아 할거라고 믿어 의심치 않는다.재료사진은 한 번에 찍지는 않았지만 적어줄게- 필수 -계란 2개즉석밥 1개양파 1/4개베이컨 80g파 1/4개마늘 3톨- 취향 -굴소스 약간 (대신 간장 넣어도 무방)소금 약간페페론치노 1개(매운거 조절은 알아서 해. 본인은 맵찔이라 1개만 넣음)파슬리등등우선 재료 손질 먼저 해야해큰 볼에 즉석밥 (데우지 않은 거) 랑 계란 2개를 까서 넣어.계란 껍질 들어갓으면 빼줘. 소금 약간 치고나서이렇게 밥알이 풀리도록 저어줘.밥알이 뭉쳐있는게 있으면 볶음밥이 망하기 딱 좋으니까 잘 풀어줘야해우리같은 뉴비들은 계란이랑 밥 따로 볶으면 망하기 딱 좋기 때문에,널리 알려지긴 했지만 이 방법으로 해서 볶으면 좀 때깔이 좋아진다.그릇 대신 비닐봉지에 섞어서 하루 낸잔고에 두고 볶아도 괜찮다.오늘을 위해 사온 마늘 슬라이서편마늘로 해서 3톨을 쓸 예정이야생각보다 시원찮다.마늘 꼭지도 썰어서 써야하는데 까먹었다.나중에 썰어줬다.꼭 꼭지 썰어서 버리고 써.그거 볶으면 약간 쓴 맛 난다칼이 더 잘 썰려서 슬픈....3톨 전부 슬라이스 하자다진 마늘 쓸거라면 써도 되는데 이따 말해주겠지만,다진 마늘은 훨씬 빨리 타기 때문에 조심해야해.나는 그냥 오늘은 편마늘로 먹고싶어서 편마늘 한거니까 취향이나 상황따라 쓸 것파는 반갈죽 해서총총 썰어줘. 반갈죽 안하고 썰어도 되긴한데, 반갈죽 하면 파가 안 흔들려서 더 잘썰려.나같은 뉴비들은 저렇게 썰자양파도 반갈죽 해서 반개를 썰어서 반만 쓸거야.이때 알았는데, 속눈썹 떨어져있더라.바로 빼고 도마 씻었다.양파 조그만하게 다진거처럼 써는 법은 기붕이들은 거진 다 알거라고 생각하지만,<U+00A0>모른다면 사진을 찍는 걸 잊었으니까 유튜브에 쳐서 찾아보자.저렇게 썰어서 반만 썼어.양파는 빼도 상관 없긴 해.볶음밥이 눅눅한게 싫고, 좀 고슬고슬한 볶음밥을 원한다면 스킵하는게 더 나은 식재료야.하지만 보닌은 냉장고에서 양파가 쓰라고 지랄중이었으므로 넣어줬다.뭣보다 제대로 해먹는건데 이것저것 다 넣고 싶었어.베이컨<U+00A0>160g짜리 한 팩인데, 이거 반만 썼다.베이컨은 길게 썰어서 준비해.꼭 베이컨 아니어도 되고 스팸도 되고, 마늘햄도 되고, 비엔나도 동그랗게 총총 썰어 넣어도 되고,급하면 핫바 썰어 넣어도 솔직히 맛잇을거야그게 자취 볶음밥의 매력아닐까중약불에 기름을 두르고 파랑 마늘, 그리고 페페론치노 하나를 손으로 뜯어서 넣었어.페페론치노 없으면 스킵해도 무방하고, 더 넣어도 무방하고, 나는 상남자라 청양고추넣겠다 하는 기붕이도 무방하다.청양고추나 고추 쓸거면 태좌(고추 씨)<U+00A0>긁어다가 쓰는 걸 추천하긴 하는데,<U+00A0>고추 넣는 시점에서 태좌 긁으면 매운 맛이 좀 빠지니까 그럴 기붕이는 없다고 본다.태좌 긁으면 좀 더 은은한 매운맛으로 변한다.파가 어느정도 오그라든다 해야하나 익으면서 파와 마늘 특유의 맛있는 냄새가 날 때까지 기름 낸다고 생각하고 볶아준다.다진마늘이면 파보다 마늘의 상태를 더 주의하면서 마늘이 타지 않게 조심해서 볶아준다.어느정도 익어서 양파랑 베이컨을 넣어줘.양파에서 물이 나오기 때문에 거품이 존나 날 수도 있는데, 괜찮다.요리가 망한 것이 아니야.베이컨은 붙은 걸 떼어 주는 느낌으로 볶아줘.양파가 투명해질 때까지 볶으면 되고, 좀 더 볶아서 물기가 더 많이 날라갈 때 까지 볶아도 무방하다.취향이니 여러번 해보면서 자신의 방법을 깨달아봐.아까 섞어둔 계란 밥을 넣기 전에 강불로 올려주고, 팬이 더 달궈진거 같으면<U+00A0>한쪽으로 볶던걸 치워서 밥을 투하해.넣고 미친듯이 볶아준다. 밥이 뭉치지 않고 한 알 한 알이 떨어지도록, 계란한테 못 살게 군다는 느낌으로,막 볶아주면 잘 볶아져.볶음밥 망하는 이유 중 하나가 대충 이정도에서 끝내는 경우인데, 딱봐도 계란이 그냥 익기만 했어.밥이 제대로 볶아지지 않고, 계란도 아직 완전히 바싹 익지 않았어.이러면 밥이 눅눅하고 볶음밥이 아니라 계란 섞은 밥이 되고 말거야. 주의해야해보닌은 양파때문에 어쩔 순 없지만 그래도 좀 더 물기를 날리고 싶어서 시간을 좀 더 써서 볶았어.굴소스 1큰술 투하. 굴소스도 입맛따라 취향따라 바꿔도 되고, 양을 조절해도 된다.밥과 잘 섞이도록 볶아줘야해. 한 쪽에 뭉치는 순간 부분 부분만 엄청 짠맛이 돈다.(대충 맛있어 보인다는 뜻)다 볶고 파슬리랑 후추 살짝 뿌렸다.오늘의 맥주는 버드와이저로 정했다. 세일하더라병따개는 베를린 암펠만 스토어에서 줏어온 병따개인데 너무 귀여워손으로 잡고 발로 뚜따하면 따져.원래 이 글 전에 유럽 여행에서 쳐먹은 것들 사진 올리려했는데,사진 정리를 덜 해서, 나중에 꼭 올리겠음.자취방 조명 가장 좋은 곳에서 찍어봄.때깔 죽인다.기음갤에 글쓰려고 접속중인 모습잘 먹었습니다.나같은 뉴비도 할 수 있는 볶음밥 꼭 해보길 바래!뉴비쉑이 만든 거라 완벽하지 않고, 재료도 훌륭하지 않지만, 누구나 할 수 있을거라고 자부한다.다음엔 유럽에서 쳐먹고, 만든거 올릴게출처: 기타음식 갤러리 [원본보기]"
"이 시각 서역에서는...","https://gall.dcinside.com/board/view/?id=superidea&no=208407&page=8",4022,14,"자신의 용맹함을 입증하는 대회가 열리고 있다  - dc official App출처: 미니어처게임 갤러리 [원본보기]"
"Frog 제작기","https://gall.dcinside.com/board/view/?id=superidea&no=208406&page=9",953,20,"아포칼립스 나우 시리즈 다섯번째 작품 Frog 제작기시리즈 목록<U+00A0>https://gall.dcinside.com/mgallery/board/view/?id=plamodels&no=27087퓨리로드때 써먹었던<U+00A0>arii 브랜드 차량을 쓰기로 했다스케일은 1/32쿼터파운더때 포 빼간 그 킷에서이번엔 샤시를 빼왔다틀딱 킷 손맛 끝내주고~내가 생각한 거보다 더 잘 어울려서 매우 만족포르쉐 샤시 대충 얹어서 붙이고영국 공수부대 피규어 남은걸 대충 조합해다 세워준다실버 칠하기 전에 괜히 서페 한번 뿌려보고하부는 검은색 뿌려놓고 건메탈 칠하기로 했다타미야 TS36 형광레드 써봤는데 한번 뿌렸을때 색이 굉장히 이뻤다사이버펑크 스러운 형광핑크가 나와버림세번쯤 뿌리니까 형광레드 나옴테두리 검은색 두르고윙도 검은색 두르고남는데칼 되는대로 붙여버림지프 데칼에 험비 데칼에 휴이 데칼에 개-판<U+00A0>덕지덕지얘는 방독면 만들어주고 야구모자 씌워줌트럼페터 PMC 킷에서 모자 빼옴기관총이 암만봐도 어색해서 망원경으로 바꿨음땟국물 대충 흘리고<U+00A0>웨더링 마스터로 열심히 비벼줌유광 그대로 둘까 고민했지만 본격적인 광 작업 자신이 없어서 무광함ㅎ근데 무광마감 하니까 형광레드 색이 데칼 흰부분에 비치더라흰부분이 다 핑크가 되버림코르크 시트 덮는게 편해서 이거도 그렇게 하려고 했는데 시트 다 쓰고 없음어쩔 수 없이 젤스톤 바르기로 함딱 이거 바를만큼만 남았더라문짝에 붙은건 방탄판임피규어 자세랑 억지로 맞추려고 손잡이 추가하면서 붙인거 아니고 진짜 방탄판 하려고 했었음아무튼 방탄판임피규어 색은 주황색요 전에 빨간색으로 칠하던거 생각나서<U+00A0>약간 텔레토비 칠하는거같기도 하고 그렇더라아래부터 완성 사진출처: 모형 갤러리 [원본보기]"
"오랜만에 현상해서 와봤읍니다,,","https://gall.dcinside.com/board/view/?id=superidea&no=208404&page=9",985,17,"카메라는 롤라이35 아니면 캐논 오토보이2필름은 코닥 포트라 400 아니면 울맥 되겠습니다.좋은 밤 되시길.출처: 필름카메라 갤러리 [원본보기]"
"오늘자 귀여움.","https://gall.dcinside.com/board/view/?id=superidea&no=208403&page=9",2344,28,"병원 가여한디 옷 입히니까 ㅋㅋ가는줄 알고 신발 물규옴.가지런히도 놔둰네. <U+00A0>버릇인데 둘중에 누가 범인인지는 아직 밝혀진게 없다.근데 애는 왜 항상 바지 안입은거같니?혹시 니네들 병원가는건 알고 있니??날씨가 너무좋아 ㅋㅋㅋㅋ병원가는데 신났오!첫째가 귀지터져서 갑자기! (알러지인가봐)심장사상충도 할겸 겸사겸사 가는중!길에서 꾸기 만남.꾸기가 날좀 좋아하나봨ㅋㅋㅋㅋ신났음 ㅋㅋ 인사가 격해!촌년들 읍내 진출ㅋㅋ흔한 팬서비스ㅋㅋㅋㅋㅋㅋ길에서 부끄럽다애카도 옴허스키앞에서 똥폼 ㅋㅋㅋ느므 알차게놀아서 아마도 내일까지 기절각!!출처: 멍멍이 갤러리 [원본보기]"
"쌉쓰압)  운수 좋은날","https://gall.dcinside.com/board/view/?id=superidea&no=208402&page=9",1152,16,"https://youtu.be/aNUE_TAFinE볼륨은 센스영상 재생후 감상 &gt;&gt;인트로https://gall.dcinside.com/mgallery/board/view?id=sims&no=56623먼저 보고 오는거 추천자기야아무래도나 임신 한거 같아워매! 나 아빠 되는겨?아싸뵹!우리자축하러 외식하자여기 예약만 받는거였음?여보님또 살인사건이래아무래도현장 출동 해야할것 같아용..어휴;ㅎㅎ; ㅈㅅ!혼자 오신건가요?임신을 하신것 같은데정말 축하드립니다!괜찮으시다면 저희 레스토랑 VIP 룸으로 초대해도 될까요?저야 좋죠!혹시 생선 요리는 좋아하십니까?아휴 분량조절 실패에귀찮아서 말풍선 안넣고 별표시도 안지움출처: 심즈 갤러리 [원본보기]"
"프레다킹 팔 늘린채로도 합체가 되는고만","https://gall.dcinside.com/board/view/?id=superidea&no=208400&page=9",1563,14,"설명서대로 합체해두고 가동아쉬워서 함 늘려봤드만 되네 손부분이 가동하다 가끔 떨어지지만 팔가동 이제 편안하다  - dc official App출처: 트랜스포머 갤러리 [원본보기]"
"필린이들을 위한 흑백 필름 자가 현상하는 방법","https://gall.dcinside.com/board/view/?id=superidea&no=208399&page=9",1275,20,"2018년 서울 레코드 페어다소 긴 글이 될 것 같으니 미리 양해를 구합니다 :D흑백 자가 현상은 고등학교 2학년 때, 사진과 입시를 준비하면서 학원에서 배웠던 게 전부였는데, 사진과 말고 다른 과를 가서 취미로 필름을 찍으면서 자가 현상을 다시 하게 될 줄은 꿈에도 생각 못했습니다. 흑백은 정말로 컬러와는 또 다른 매력이 있는 것 같습니다. 컬러를 찍다가도 어느 순간 흑백이 문득 생각나더라구요.그래서 오랜만에 흑백 필름을 쓴 겸, 자가 현상 방법을 정리하려고 합니다.시작에 앞서 본 글은 '이것이 정석이다!, 내가 잘배웠다!'가 아닌, '그냥 취미를 즐기는 사람으로서, 나는 이렇게 현상하는데도 큰 문제는 없더라.'를 보여드리고 싶은 것일 뿐, 제가 쓰는 모든 이야기가 정석은 아닙니다.우선 흑백 필름을 꺼내야겠죠? 다 찍은 필름의 꼬다리를 꺼내어 암백에서 감는 것부터 시작해보도록 하겠습니다.현상 준비물 / 암백, 현상 탱크, 릴, 온도계, 필름 피커, 비커 3개, 집게(필름 건조할 때), 가위, 현상액, 정지액, 정착액, 포토플로, 스퀴저1. 현상 탱크에 필름 감기 암백에서 현상 탱크에 필름을 넣는 것은 제가 사진을 못 찍기도 하였고,보여드리기 어려운 부분이라 영상을 첨부하도록 하겠습니다.135 필름 릴 감는 법120 필름 릴 감는 법두 분이 굉장히 설명을 잘 해주셨더라구요.저는 120 필름을 현상할 겁니다.2. 현상 데이터 확인하는 법이제 현상 탱크에 필름이 준비 되었으니 몇 분이나 현상을 해야되는지 데이터를 먼저 봐 봅시다.아래에 써져있는 사이트로 들어갑니다.현상 데이터 보는 곳(클릭)우선 열면 이렇게 영어밖에 안 쓰여 있는데, 우리는 영어를 몰라도 할 수 있습니다.첫 번째 탭은 Select a Film우리가 사용한 흑백 필름을 골라줍니다. 아직 여기에 없는 흑백필름을 사용해본적이 없습니다만, 만약 여기에 없는 흑백필름을 사용하실 정도의 내공이라면, 구글링을 통해 현상 데이터를 잘 찾을 수 있으실 거라 생각합니다.두 번째 탭은 All Developers두 번째 탭에서는 사용하는 현상액을 골라주시면 됩니다. 저의 경우에는 Ilfosol 3이기 때문에 이것을 골라주었습니다.그 아래에 보이는 온도 표시와 시간표시는 본인의 취향대로 맞추면 됩니다만, 한국에서 화씨를 쓸 일이 없으니 섭씨로 사용하도록 하겠습니다.시간은 정말 취향입니다만 저는 0:00으로 하겠습니다.위 같이 설정한 후 Search를 누르시면이렇게 현상 데이터가 나오게 됩니다.여기에서 좀 많은 정보들이 나오는데,일단 ①번과 ②번의 경우에는 우리들이 설정 해 놓은 필름의 종류와 현상액의 종류입니다.③번은 비율, 1+9와 1+14의 비율로 나뉘어 있는데 저는 1+9의 비율로 사용하니 1+14는 보지 않습니다.④번은 감도(ASA/ISO). 저는 TMax 400을 400의 감도 그대로 현상하고 싶으니 400으로 골라줍니다.⑤번과 ⑥번은 사용하시는 필름이 135 필름인지 120 필름(중형)인지에 따른 현상 시간입니다.⑦의 시트는 잘 모르겠지만 데이터 시트가 그렇게 나온다는 건가요...? (혹시 아시는 분은 댓글을 남겨주세요)⑧은 처음부터 누누이 이야기했던 온도입니다. 20도로 맞춰줍시다. 그렇게 되면 저희 설정해야 할 시간은 6분이군요.3. 현상 용액 제조하기(Ilford Ilfosol 3, Ilfostop, Rapid Fixer)현상액(Develope)은 일포솔 3, 정지액(Stop)은 일포스탑, 정착액(Fix)은 래피드 픽서를 사용합니다.가루로 되어있는 D-76의 경우에는 자주 사용하지 않는 다면 보관에 용이하지만 물에 풀어서 사용해야 한다는 불편함이 있어서 쓰진 않습니다. 한 달에 한두 번 정도는 흑백 자가 현상을 하는데, 냉장보관만 잘 되어 있다면 아예 용액으로 되어있는 약품을 쓰는 게 더 편리하다고 생각되어 쓰는 것일 뿐, 가루약이 안 좋아서 쓰지 않는 것은 아닙니다.우선 큰 대야에 물을 21도 정도로 맞춰서 넣어줍니다. 집 온도가 차서 시간이 조금만 지나면 계속해서 온도가 떨어져서, 다른 용액의 온도를 맞춰주기 위해 21도로 해 놓습니다. 용액들의 온도는 전부 20도로 맞춰야 합니다.현상 탱크 하나를 현상하는 데에는 각 각 500ml의 용액이 들어갑니다.자 이럴 때, 용액의 비율이 중요한데요. 대부분의 경우 용액의 앞쪽에 희석 비율이 써져 있습니다.현상액 Ilfosol 3 / 1(용액)+9(물)의 비율로 500ml / 현상 용액 50ml + 물 450ml정지액 Ilfostop / 1(용액)+19(물)의 비율로 500ml / 정지 용액 25ml + 물 475ml정착액 Rapid Fixer / 1(용액) + 4(물)의 비율로 500ml / 정착 용액 100ml + 물 400ml제가 쓰는 용액과 같으시다면 위와 같이 맞춰주시면 됩니다.준비가 되었다면 용액들을 반식욕 시켜줍시다.4. 현상 타이머 설정하기(Dev It!)용액이 준비되었다면 본 현상에 들어가기 전, 시간을 맞춰봅시다저는 Dev it! 이라는 어플을 이용해 현상을 합니다. 안드로이드와 애플 모두 사용 가능합니다.크게 설정해야 될 것은 세 부류입니다. 1. Developer Bath2. Stop Bath3. Fix BathPre wash의 경우에는 현상하기 전 흑백 필름에 묻어있는 약품을 씻어내는 용도로 사용하는 것으로 알고 있는데, 저의 경우에는 1분 동안 연속 교반을 하면서 씻어줍니다. (교반 하는 방법은 아래에 영상으로 나와있습니다.) Developer Bath는 저희가 아까 현상 데이터 사이트에서 본 6분으로 설정하고Stop Bath는 1분, Fix Bath는 3분으로 해 두도록 하겠습니다.현상을 시작하면서, 우측 상단의 Start! 를 눌러주시면 됩니다.5. 현상 시작(현상 시작 전 주의사항을 알려드리자면, 사진에 사용된 모든 용액은 따로 페트병에 담아 폐기처리하고 있습니다. 예전에는 하수구에 버렸다는데 요즘엔 안된다고 들어서, 사용한 현상액 정지액 정착액은 꼭 다 모아서 폐기처분해주세요 :D)1. 본 현상 전, 전습(Pre wash)을 해줍니다. 1분 정도 연속 교반을 해주면 필름에 따라 다르지만 파란색 물이 나오기도 합니다. 교반과 관련해서는 아래의 영상을 봐주시면 됩니다. &lt;iframe title=""'하고의 취미골방'에서 업로드한 동영상"" width=""640"" height=""360"" src=""https://play-tv.kakao.com/embed/player/cliplink/406615528?service=daum_tistory"" allowfullscreen="""" frameborder=""0"" scrolling=""no"" allow=""autoplay""&gt; 교반은 정말 사람마다 다른 부분이라 딱 집어서 말씀드리기는 어렵습니다.주변에는 한 손으로 돌리시는 분도 계시고 8자를 그리면서 돌리시는 분들도 계시기에...다만 무난한 방법을 알려드립니다.이 사진은 정착액을 넣는 장면이지만, 교반이 끝난 후 사용한 용액은 다시 비커에 쏟아주시면 됩니다.여기서부터 중요합니다.현상액 교반 방법1. (타이머가 돌아가기 시작하고 나서) 바로 용액을 부어줍니다.2. 15초 연속 교반3. 가만히 바닥에 내려놓습니다.4. 1분이 되었을 때 10초 동안 연속 교반(1초에 한 번 뒤집는 속도로)5. 다시 1분 10초부터 2분까지 바닥에 내려놓습니다.6. 2분부터 2분 10초까지 연속교반7. 매 분마다 10초동안 연속교반즉 첫 15초 연속 교반, 이후 매 분마다 10초씩 연속 교반을 해주시면서 6분을 채워주시면 됩니다.말로는 어려울 수 있지만 직접 해 보신다면 금방 하실 수 있으실 겁니다.저의 경우에는 타이머가 1초를 찍기 시작하면서부터 용액을 부으면 13초 정도에 용액이 다 들어가더라고요.그러면 뚜껑을 닫고, 15초를 교반 하면 30초가 되어있고, 30초 정도를 쉬면 1분이 되어 10초 동안 연속 교반 후 휴식.다시 2분이 되면 10초동안 연속교반 후 휴식을 이어갑니다.정지액 교반 방법정지액의 경우에는 1분 동안 연속교반 해주신 후 용액을 비워주시면 됩니다.정착액 교반 방법현상액과 마찬가지로 첫 15초 연속교반 후 매 분마다 10초 교반 해주시면 됩니다.이 작업까지 마치셨으면 이제 필름을 밖으로 꺼내셔도 됩니다... 만!아직 한 가지가 더 남아있습니다.포토 플로(photo-flo : 물의 표면장력을 줄여 필름을 건조하는 동안 생기는 얼룩 방지)뚜껑을 오픈한 후 물 위에 포토 플로를 두세 방울 떨어트려 줍니다.30~40초 정도 아래와 같이 펌핑(?)을 해줍니다.근데 솔직히 이 부분도 정석이 아닙니다. 그냥 이게 편해서 하는 겁니다.이렇게 포토 플로까지 끝났다면 필름을 릴에서 분리하신 후 스퀴저로 쭈욱 짜줍니다.건조의 경우에는 최대한 먼지가 없는 곳이 좋기에 저의 경우에는 화장실에서 말려줍니다.옆 쪽에 파란부분이 너무너무너무너무 신경쓰이지만, 스캔상 문제는 없기에 패스하겠읍니다.전용 건조기가 있다면 더욱 좋겠지만, 현재까지는 이렇게 해서 문제가 생긴 적은 없었습니다.한 시간 정도 말린 후 3장씩 잘라 스캔을 해줍니다.6. 필름 스캔(Epson V800)원래는 실버패스트를 썼었는데, 형의 컴퓨터에 깔린 채로 컴퓨터가 사라졌기에 저는 엡손 기본 프로그램을 사용하고 있습니다.기본임에도 굉장히 준수한 성능을 보여주기에 tiff 확장자로 크게 스캔한 뒤 포토샵이나 라이트룸을 통해 먼지와 후보정을 잡아주고 있습니다.(진짜 스캔은 먼지와의 싸움... 불어도 불어도 끊임없이 나와...)스캔 전에도 먼지가 있나 없나 꼼꼼히 살펴봅시다.여러분거는 없다구요?있습니다. 하하위와 같이 프로그램으로 스캔 해 주시면 됩니다.스캔 프로그램 내부에 먼지 제거 기능이 있긴 하지만 기본은 썩 믿음직스럽지가 못해서 저의 경우는 라이트룸을 통해 다 지우고 있습니다.7. 결과물짜잔 필름의 정체는 낙안읍성에서의 댕댕이와 같은 쉐어하우스에 살고 있는 친한 형님이셨습니다 ~_~8. 마치며위에도 말씀드렸지만, 이 방법은 취미로 사진을 즐기는 학생의 개인적인 방법일 뿐, 정석이 아니라는 점을 다시 한 번 강조하고 싶습니다.애초에 이 글을 쓴 것도, '나 이정도로 잘 안다!'가 아니라, 제가 알고있는 것을 기록하고 싶은 마음에서 였습니다.더불어 혹시 도전해보고 싶으신데 어디서부터 시작해야될지 모르겠는 분들에게 길잡이가 되어드리고 싶은 마음도 있었습니다.이 글은 정말 초심자 과정이라고만 생각하시고 본인만의 방식으로 본인만의 현상 데이터를 구축해 나아가시는 것을 추천드립니다. 솔직히 20도? 안 맞춰도 상은 다 나옵니다. 19도일 때 했을 때도 상은 잘 나왔고, 21도에서 해도 큰 문제는 없었습니다. 혹시나 틀리면 어쩌지 생각하다가 현상을 미뤘던 적이 한두 번이 아닌데(특히 맨날 현상하려고 하면 약품 비율을 까먹는 바람에), 막상 하면 잘 됩니다.실패도 해보고 성공도 해봐야 더욱 즐겁게 할 수 있는 게 아닐까요?오늘은 이만 줄이도록 하겠습니다. 감사합니다 :)출처: 필름카메라 갤러리 [원본보기]"
"이쯤에서 다시보는... 임진모 명언...jpg","https://gall.dcinside.com/board/view/?id=superidea&no=208398&page=9",2036,29,"임진모 당신은 대체 무슨 싸움을 해오신 겁니까...출처: 포스트락 갤러리 [원본보기]"
"무려 ... 6번이나 경고한 의협 ㄹㅇ; ....jpg","https://gall.dcinside.com/board/view/?id=superidea&no=208396&page=9",71481,2828,"?????? 이런데도 아직까지 입국 금지 조치 계획 X 참고로 오늘 날짜임 ㅇㅇㅋ 출처: 국내야구 갤러리 [원본보기]"
"스압) 심즈3 최적화하기","https://gall.dcinside.com/board/view/?id=superidea&no=208395&page=9",1662,31,"오늘은 발적화겜 심즈3를 최적화 시켜보겠습니다먼저 심을 한 명 준비해주세요이 심을 이용해 다른 심들을 죽이면서 최적화를 하면 댑니다심 5명분의 최적화가 이루어졌습니다총으로 죽이면 강제로 심의 영정사진을 얻을 수 있습니다심이 사는 집 한구석에 지하실을 만들어주세요계단을 내려가고긴 복도도 건너면!!최적화 명예의 전당 방이 나옵니다누군가 허락도 없이 명예의 전당 침대에서 자고 있습니다할배입니다살인마 심의 큰아빠<U+00A0>심이지만 최적화를 위해 죽여봅시다쥬금담배피고 있었는데 옆에 다른 가족들이 쟤 죽는거 볼라고 내려왔군요ㅠ(문 잠가놨었는데ㅜ)하는 수 없이 쟤네도 최적화행~아까 명예의 전당 사진 훔쳐보던 심도 최적화행계속 최적화를 하다보면 사신이랑 상호작용도 가능해져욥~서로 좋아하네이렇게 우리 가좍!!!도 최적화 명예의 전당에 오르게 되었는데.....뒤에서 화내는 할배심.....할아버지는 죽이기 미안하니까 명예의 방에 가둬놓아봅시다어차피 수명 한참 넘겨서 죽기만을 기다리는 심...~이제 마을로 이동해서 최적화를 시작해봅시다집으로 찾아가는 최적화 서비스였는데 이새끼들 뱀파이어라 안죽음ㅠ지나가던 할모니 최적화 성공!커플 두 명 한방에 날려버리기 성공~심즈3 최적화하기 공략 끝~출처: 심즈 갤러리 [원본보기]"
"엡글 인스타","https://gall.dcinside.com/board/view/?id=superidea&no=208394&page=9",1835,12,"https://www.instagram.com/p/B8yUmxjBF3S/?igshid=hlenmdb9ohzj 출처: 여자 아이돌 갤러리 [원본보기]"
